"121.506637, 31.241564",x,x,,,International Chamber of Commerce,法国国际商会,Shanghai Commission of Commerce,上海市商务委员会,France,Trade,从事有关在华贸易和投资方面的信息交流、市场调研，为促进两地间经贸往来进行业务联络，协助组织听证，协助组织培训,Shanghai,2017-05-31,"Beijing, Guangdong, Jiangsu, Shanghai, Zhejiang",https://iccwbo.org/,,上海市浦东新区银城中路68号时代金融中心2289室,5,,,,,,,,,,,,,,,,,,,,,,,,,,,,,1,,,,,1,,,,1,,,,,,,,,,1,,,,,,,,1,,,,,,,,1,,1,5,上海市、北京市、江苏省、浙江省、广东省,,,
"112.984410, 28.158674",x,x,,,International China Concern,国际关心中国慈善协会有限公司,Hunan Department of Civil Affairs,湖南省民政厅,Hong Kong,Civil Society Capacity-Building,从事社会福利慈善项目开发和相关的管理、培训以及与政府有关部门的联络工作,Hunan,2019-03-11,Hunan,,https://www.chinaconcern.org/%E5%85%B3%E4%BA%8E%E6%88%91%E4%BB%AC/%E6%88%91%E4%BB%AC%E7%9A%84%E5%9B%A2%E9%98%9F/?lang=zh-hans,湖南省长沙市天心区 芙蓉中路三段420号华升大厦1110室,27,,,,,1,,,,,,,,,,,,,,,,,,,,,,,,,,,,,,,,,,,,,,,,,1,,,,,,,,,,,,,,,,,,,,1,1,湖南省,,,
"116.458606, 39.907432",x,x,,,International Confederation of Societies of Authors and Composers,国际作者和作曲者协会联合会,National Copyright Administration,国家版权局,France,Trade,会员著作权认证和保护相关联络工作，创作者权益保护相关研究、联络工作，举办相关活动,Beijing,2017-04-10,China,http://www.cisac.org/,,北京市朝阳区建国门外大街2号院3号楼15层1549室,4,,,,,,,,,,,,,,,,,,,,,,,,,,,,,1,,,1,,,,,,,,,,,,,,,,,,,,,,,,,,,,,,,,,,1,0,中国,,,
"103.881743, 36.069785",x,x,,,International Consulting and Resources Enterprise,国际咨询与资源企业,Gansu Health Commission (formerly Gansu Health and Family Planning Commission),甘肃省卫生和计划生育委员会,United Kingdom,"Disaster Relief, Health, Poverty Alleviation",甘肃省部分地区的 卫生、济困救灾、福利服务	,Gansu,2017-04-07,China,,,甘肃省兰州市城关区 雁北路鸿运润园C06 2单元 203,4,,,,,,,1,,,,,,,1,,,,,,,,,1,,,,,,,,,1,,,,,,,,,,,,,,,,,,,,,,,,,,,,,,,,,,3,0,"云南省,陕西省,广东省,安徽省,宁夏回族自治区,湖北省,山东省,江西省,青海省,新疆维吾尔自治区,新疆兵团,贵州省,吉林省,重庆市,天津市,辽宁省,山西省,河南省,内蒙古自治区,海南省,四川省,福建省,甘肃省,西藏自治区,广西壮族自治区,江苏省,黑龙江省,上海市,浙江省,湖南省,河北省,北京市",,,
"116.440581, 39.921190",x,x,1,,International Copper Association (Beijing),国际铜专业协会,Ministry of Industry and Information Technology,中华人民共和国工业和信息化部,United States,Trade,从事有关铜、铜产品贸易开发和改进咨询的业务联络。,Beijing,2018-05-21,"Anhui, Beijing, Chongqing, Gansu, Guizhou, Hebei, Heilongjiang, Henan, Inner Mongolia, Jilin, Liaoning, Ningxia, Qinghai, Shaanxi, Shandong, Shanxi, Tianjin, Tibet, Xinjiang",http://copperalliance.org/,,北京市朝阳区 朝外西街3号1幢兆泰国际中心E座4层407室,17,,,,,,,,,,,,,,,,,,,,,,,,,,,,,1,,,,1,1,1,,1,,,1,,1,1,1,,,1,,,1,1,1,1,1,1,,1,,1,1,1,,,,,1,19,"北京市,天津市,河北省,山西省,内蒙古自治区,辽宁省,吉林省,黑龙江省,安徽省,山东省,河南省,重庆市,贵州省,西藏自治区,陕西省,甘肃省,青海省,宁夏回族自治区,新疆维吾尔自治区",,,
"121.472808, 31.221844",x,x,1,,International Copper Association (Shanghai),国际铜专业协会,Shanghai Commission of Commerce,上海市商务委员会,United States,Trade,从事有关铜、铜产品贸易开发和改进咨询的业务联络。,Shanghai,2017-04-01,"Fujian, Guangdong, Guangxi, Hainan, Hubei, Hunan, Jiangsu, Jiangxi, Shanghai, Sichuan, Yunnan, Zhejiang",http://copperalliance.org/,,上海市黄浦区淮海中路381号中环广场2814-19室,4,,,,,,,,,,,,,,,,,,,,,,,,,,,,,1,,,,,,,1,,1,1,,1,,,,1,1,,1,1,,,,,,,1,,1,,,,,1,1,,1,12,上海市、江苏省、浙江省、福建省、江西省、湖北省、湖南省、广东省、广西壮族自治区、海南省、四川省、云南省,,,
"116.459861, 39.908765",x,x,,The ,International Council on Clean Transportation,国际清洁交通委员会,Ministry of Ecology and Environment (formerly Ministry of Environmental Protection),中华人民共和国环境保护部,United States,"Environment, International Relations/Exchange, Law and Governance",开展移动污染源排放管理、环境空气质量和公众健康相关技术、政策研究，促进这一领域中国与国际的交流与合作，包括组织培训以及技术、政策交流研讨会等,Beijing,2018-05-21,China,https://www.theicct.org/,,北京市朝阳区 建国门外大街19号国际大厦A座2505室,17,,,,,,,,,,,1,,,,,,1,,1,,,,,,,,,,,,,1,,,,,,,,,,,,,,,,,,,,,,,,,,,,,,,,,,3,0,中国境内,,,
"116.431274, 39.986677",x,x,,,International Crane Foundation,国际鹤类基金会,National Forestry and Grassland Administration (formerly State Forestry Administration),国家林业局,United States,"Animal Protection, Environment",致力于鹤类研究与保育相关的环境保护，包括鹤类栖息地的保护、管理及恢复。,Beijing,2017-08-15,"Anhui, Beijing, Gansu, Guizhou, Hainan, Hebei, Heilongjiang, Hubei, Inner Mongolia, Jiangsu, Jiangxi, Jilin, Liaoning, Qinghai, Shandong, Shanghai, Sichuan, Tianjin, Tibet, Xinjiang, Yunnan, Zhejiang",https://www.savingcranes.org/,,北京市朝阳区芍药居北里101号 1幢22层2座2602室,8,,,1,,,,,,,,1,,,,,,,,,,,,,,,,,,,,,,1,1,,,1,,,1,1,1,1,,1,,1,1,1,1,1,,1,,1,1,,1,1,1,1,,1,1,,2,22,"北京市,天津市,河北省,内蒙古自治区,辽宁省,吉林省,黑龙江省,上海市,江苏省,浙江省,安徽省,江西省,山东省,湖北省,海南省,四川省,贵州省,云南省,西藏自治区,甘肃省,青海省,新疆维吾尔自治区",,,
"102.245757, 27.885989",x,x,,,International Development & Educational Associates (IDEAS),国际教育扶贫机构,Sichuan Department of Education,四川省教育厅,United States,"Agriculture, Education, Health, Infrastructure, Poverty Alleviation, Rural Issues/Development, Youth",IDEAS在四川的工作限于非盈利性公益扶贫项目，主要针对凉山等贫困地区开展教育助学（贫困学生资助、大学生关爱、山区小学修建、学校设备捐赠、学校安全饮水及学生健康卫生项目）和农村建设（农村安全饮水、农村住房与卫生、农村小型产业发展）两类公益扶贫项目。,Sichuan,2018-04-23,Sichuan,https://www.ideasworld.org/,,四川省凉山彝族自治州西昌市航天道1号（小区）1幢1单元1208#,16,,1,,,,,,,1,,,,,1,,1,,,,,,,1,,1,,,,,,1,,,,,,,,,,,,,,,,,,,,,,,,,,,1,,,,,,,,7,1,四川省,,,
"116.451393, 39.945744",x,x,1,,International Fund for Animal Welfare (IFAW) (Beijing),国际爱护动物基金会,National Forestry and Grassland Administration (formerly State Forestry Administration),中华人民共和国国家林业局,United States,"Animal Protection, Environment",涉及生物多样性及野生动物保护（受中国法律保护的）的各项工作，包括野生动物种群、个体及栖息地保护，针对野生动物的犯罪预防，针对公众开展野生动物保护和生态文明建设的宣传和教育。,Beijing,2018-05-16,"Anhui, Beijing, Fujian, Gansu, Guangdong, Guangxi, Hainan, Heilongjiang, Henan, Hubei, Hunan, Inner Mongolia, Jiangsu, Jilin, Liaoning, Qinghai, Shaanxi, Shandong, Shanghai, Sichuan, Tianjin, Zhejiang",https://www.ifaw.org/,http://www.ifaw.org/china,北京市朝阳区 亮马河南路14号塔园外交办公楼1-7-1,17,,,1,,,,,,,,1,,,,,,,,,,,,,,,,,,,,,,1,1,,1,1,1,1,,1,,1,1,1,1,1,1,,1,1,,1,1,1,1,,1,1,,,,,1,,2,22,"北京市,天津市,内蒙古自治区,辽宁省,吉林省,黑龙江省,上海市,江苏省,浙江省,安徽省,福建省,山东省,河南省,湖北省,湖南省,广东省,广西壮族自治区,海南省,四川省,陕西省,甘肃省,青海省",,,
"100.979966, 22.774968",x,x,1,,International Fund for Animal Welfare (IFAW) (Yunnan),国际爱护动物基金会,Yunnan Forestry and Grassland Administration (formerly Yunnan Forestry Administration),云南省林业厅,United States,"Animal Protection, Environment",1. 保护云南的亚洲象和其他濒危陆生物种的栖息地和种群；2. 开展社区发展项目以促进人与野生动物和谐共处；3. 在社区、学校以及涉及野生动物的行业范围内开展教育和普及活动以提高人与野生动物相处的安全意识和保护意识；4. 开展科学研究以向政府和非政府合作伙伴提供有效的亚洲象栖息地和种群保护的咨询和信息；5.与当地政府机构、自然保护区管理机构、非政府组织和其他利益相关方合作，通过开展宣传活动获取公众支持，以促进亚洲象保护和其他野生动物保护；6. 通过媒体和普及活动宣传野生动物保护和环境保护,Yunnan,2017-04-10,Yunnan,http://www.ifaw.org/,http://www.ifaw.org/china,云南省普洱市思茅区人民东路38号源海商厦911,4,,,1,,,,,,,,1,,,,,,,,,,,,,,,,,,,,,,,,,,,,,,,,,,,,,,,,,,,,,,,,,,,,1,,,2,1,云南省,,,"Yarmouth Port, MA"
"116.437474, 39.924639",x,x,,,International Fur Federation,国际毛皮协会,Beijing Commission of Commerce,北京市商务委员会,United Kingdom,Trade,从事国际与中国之间毛皮领域经济交流与合作。,Beijing,2018-05-16,"Beijing, Guangdong, Hebei, Heilongjiang, Jiangsu, Jilin, Liaoning, Shandong, Zhejiang",https://www.wearefur.com/,,北京市朝阳区 朝外大街10号昆泰大厦1406室,17,,,,,,,,,,,,,,,,,,,,,,,,,,,,,1,,,,,1,,,,1,,,,1,1,,,,,1,,1,1,,,,1,,,,,,,,,1,,1,9,"北京市,河北省,辽宁省,吉林省,黑龙江省,江苏省,浙江省,山东省,广东省",,,
"106.525174, 29.556503",x,x,,,International Hot Pot Industry Alliance,国际火锅产业联盟,Chongqing Commission of Economy and Informatization,重庆市经济和信息化委员会,Hong Kong,"Arts and Culture, Trade",1、整合全球火锅产业资源，构建火锅产业全球化交流与合作平台。推动火锅产业上下游、海内外联动发展 ；2、在海内外举办火锅产业相关的论坛、会议、会展活动；3、开展火锅产业相关的理论研究、管理与技术培训;4、在全球范围内开展火锅美食文化宣传与推广服务；5、帮助境内火锅产业相关的企业开展海外市场拓展业务，提供企业走出去和引进来国际性商务合作咨询服务；6、火锅产业相关产品的进出口国际贸易咨询服务；7、火锅产业食材交易与供应链咨询服务；8、促进海内外火锅产业食品工业生产、加工技术交流、信息交流与合作；9、整合海内外资本市场资源，促进海内外资本与火锅产业对接，开展火锅产业相关的商业投资与国际合作。,Chongqing,2018-02-07,China,,,重庆市江北区 北滨一路368号金源购物中心时代广场五层（火锅美食大观园）,14,,,,1,,,,,,,,,,,,,,,,,,,,,,,,,1,,,1,,,,,,,,,,,,,,,,,,,,,,,,,,,,,,,,,,2,0,中国境内,,,
"114.037005, 22.63439",x,x,,,International Peace Foundation,国际和平交流基金会,Ministry of Civil Affairs,民政部,Hong Kong,"Arts and Culture, Education, Health, International Relations/Exchange",支持促进国际和平交流与合作项目；提供国际和平及热点问题双边和多边交流研讨活动资金赞助；资助医疗、文化、教育以及国际间救援等公益活动；赞助社会福利、社会救助、公益慈善、灾害救援等活动。,Guangdong,2017-01-19,Guangdong,,,广东省深圳市龙华新区民治街道新区大道远景大厦9层,1,,,,1,,,,,1,,,,,1,,,1,,,,,,,,,,,,,,,,,,,,,1,,,,,,,,,,,,,,,,,,,,,,,,,,,,4,1,广东省,,,
"116.324892, 39.9581",x,x,1,,International Plant Nutrition Institute (Beijing),国际植物营养研究所,Ministry of Agriculture and Rural Affairs (formerly Ministry of Agriculture),农业部,Canada,Agriculture,在华开展非营利性的养分高效利用相关合作项目以及教育培训,Beijing,2018-02-12,"Beijing, Chongqing, Gansu, Guangdong, Guangxi, Guizhou, Hainan, Hebei, Heilongjiang, Henan, Inner Mongolia, Jilin, Liaoning, Ningxia, Qinghai, Shaanxi, Shandong, Shanxi, Sichuan, Tianjin, Tibet, Xinjiang, Xinjiang Bingtuan, Yunnan",http://www.ipni.net/,http://china-zh.ipni.net/,北京市海淀区 中关村南大街12号9号楼（土肥楼）315,14,,1,,,,,,,,,,,,,,,,,,,,,,,,,,,,,,,,1,1,,1,1,1,1,1,1,1,1,,,1,,,1,1,1,1,1,1,,1,1,1,1,1,1,1,,,1,24,"北京市,天津市,河北省,山西省,内蒙古自治区,辽宁省,吉林省,黑龙江省,山东省,河南省,广东省,广西壮族自治区,海南省,重庆市,四川省,贵州省,云南省,西藏自治区,陕西省,甘肃省,青海省,宁夏回族自治区,新疆维吾尔自治区,新疆兵团",,,
"114.42369, 30.545601",x,x,1,,International Plant Nutrition Institute (Hubei),国际植物营养研究所,Hubei Department of Agriculture and Rural Affairs (formerly Hubei Department of Agriculture),湖北省农业厅,Canada,Agriculture,协助执行加拿大国际植物营养研究所在华开展的合作项目，以及与湖北省相关机构的合作,Hubei,2017-05-15,"Anhui, Hubei, Hunan, Jiangsu, Jiangxi, Shanghai, Zhejiang",https://ipni.net/,http://www.ipni.ac.cn/ipni/home/index.html,湖北省武汉市武昌区 武汉市武昌磨山，中国科学院武汉植物园实验楼223室,5,,1,,,,,,,,,,,,,,,,,,,,,,,,,,,,,,,1,,,,,,,,,,,,1,1,,1,1,,,,,,,1,,,,,,,,1,,1,7,"湖北省,湖南省,安徽省,江西省,江苏省,浙江省,福建省,上海市",,,
"120.178049, 30.269712",x,x,,,International Silk Union,国际丝绸联盟,Zhejiang Department of Commerce,浙江省商务厅,Hong Kong,Trade,开展国际丝绸产业文化、教育、科研、设计、生产、标准与检测、贸易、投资、消费等方面的交流与合作。,Zhejiang,2019-08-26,China,http://en.worldsilk.com.cn/,,浙江省杭州市下城区体育场路105号凯喜雅大厦1606室,32,,,,,,,,,,,,,,,,,,,,,,,,,,,,,1,,,1,,,,,,,,,,,,,,,,,,,,,,,,,,,,,,,,,,1,0,中国境内,,,
"117.181207, 39.118767",x,x,,,International Silkroad Trade and Culture Association,国际丝路经贸和文化协会,Tianjin Commission of Commerce,天津市商务委员会,Turkey,"Arts and Culture, International Relations/Exchange, Tourism, Trade",代表土耳其“国际丝路经贸和文化协会”组建协会驻中国办事处，按照协会的章程帮助协会在中国开展各种经贸和文化交流活动，活动主要围绕两国之间的经贸和文化交流促进发展，旅游文化活动、社会团体互访、展览、演出等大型活动。,Tianjin,2017-07-11,Tianjin,,,天津市和平区卫津路73号嘉利中心1708室,7,,,,1,,,,,,,,,,,,,1,,,,,,,,,,,1,1,,,,,,,,,,,,,,,,,,,,,,,,,,,,,,1,,,,,,,4,1,中华人民共和国,,,
"116.315571, 39.983130",x,x,,,International Trademark Association (Beijing),国际商标协会,Beijing Intellectual Property Office,北京市知识产权局,United States,Trade,围：	从事有关知识产权的信息交流、市场调研，为促进国际间的经贸往来进行业务联络,Beijing,2019-09-16,Beijing,http://www.inta.org/Pages/Home.aspx,http://china.inta.org/,北京市海淀区 中关村南大街1号16幢63203,33,,,,,,,,,,,,,,,,,,,,,,,,,,,,,1,,,,,1,,,,,,,,,,,,,,,,,,,,,,,,,,,,,,,,1,1,北京市,,,
"121.450863, 31.224339",x,x,,,International Trademark Association (Shanghai),国际商标协会公司,Shanghai Commission of Commerce,上海市商务委员会,United States,Trade,从事有关知识产权的信息交流、市场调研，为促进国际间的经贸往来进行业务联络。,Shanghai,2017-04-01,China,http://www.inta.org/Pages/Home.aspx,http://china.inta.org/,上海市静安区南京西路1515号静安嘉里中心办公楼一座29楼,4,,,,,,,,,,,,,,,,,,,,,,,,,,,,,1,,,1,,,,,,,,,,,,,,,,,,,,,,,,,,,,,,,,,,1,0,中国,,,
"117.003530, 36.597119",x,x,,,International Union Against Tuberculosis and Lung Disease,国际防痨和肺部疾病联合会,Shandong Health Commission (formerly Shandong Health and Family Planning Commission),山东省卫生和计划生育委员会,United States,"Health, Law and Governance",与政府和其他伙伴合作，结合偱证和创新，为中国和世界其他国家公共卫生系统和队伍的建设，政策的完善，实践和研究提供资金和技术支持。,Shandong,2018-08-29,China,https://www.theunion.org/where-we-work/asia-pacific/china-office,https://www.theunion.org/where-we-work/asia-pacific/china,山东省济南市市中区 二环南路2666号鲁能国际中心15楼雷格斯,20,,,,,,,,,,,,,,1,,,,,1,,,,,,,,,,,,,1,,,,,,,,,,,,,,,,,,,,,,,,,,,,,,,,,,2,0,中国境内,,,
"121.456163, 31.231486",x,x,,,International Zinc Association (Shanghai),国际锌协会,Shanghai Commission of Commerce,上海市商务委员会,United States,Trade,从事有关锌金属和锌合金的产品介绍、信息交流、市场调研，为促进两国间的经贸往来进行联络。,Shanghai,2019-04-30,China,https://www.zinc.org/,N/A,上海市静安区 北京西路968号739室,28,,,,,,,,,,,,,,,,,,,,,,,,,,,,,1,,,1,,,,,,,,,,,,,,,,,,,,,,,,,,,,,,,,,,1,0,中国境内,,,
"121.312004, 31.194926",x,x,,,Investe São Paulo Investment Promotion Agency,巴西圣保罗州投资促进局,Shanghai Commission of Commerce,上海市商务委员会,Brazil,Trade,经贸促进领域的业务联络，协助巴西圣保罗州企业在中国市场拓展商业机构，促进巴西圣保罗州企业和中国各地的商贸往来，并吸引中国到巴西圣保罗州外商直接投资。,Shanghai,2019-09-12,"Anhui, Beijing, Chongqing, Fujian, Guangdong, Henan, Hubei, Hunan, Jiangsu, Shanghai, Sichuan, Zhejiang",https://www.en.investe.sp.gov.br/,N/A,上海市闵行区 申武路159号，二座四层404A室,33,,,,,,,,,,,,,,,,,,,,,,,,,,,,,1,,,,1,1,1,1,,1,,,,,,1,1,1,,1,,,,,,,,1,,1,,,,,,1,,1,12,"北京市,上海市,江苏省,浙江省,安徽省,福建省,河南省,湖北省,湖南省,广东省,重庆市,四川省",,,
"116.460898, 39.93044",x,x,,,IRU,国际道路运输联盟,Beijing Commission of Transport,北京市交通委员会,Switzerland,Trade,与国际道路运输联盟业务有关的非营利性经贸交流活动。,Beijing,2017-11-28,"Beijing, Chongqing, Guangxi, Heilongjiang, Inner Mongolia, Shanghai, Sichuan, Xinjiang",https://www.iru.org/,https://www.iru.org/zh/who-we-are,北京市朝阳区 东三环北路19号1501内05室,11,,,,,,,,,,,,,,,,,,,,,,,,,,,,,1,,,,,1,1,,,,1,,,,1,,,,1,,,,,,,,,1,,1,,,1,,,,,1,8,"北京市,内蒙古自治区,黑龙江省,上海市,广西壮族自治区,重庆市,四川省,新疆维吾尔自治区",,,
"121.647492, 38.922244",x,x,1,,Iwate Industrial Revitalization Center (Liaoning),日本公益财团法人岩手产业振兴中心,Liaoning Department of Commerce,辽宁省商务厅,Japan,"International Relations/Exchange, Tourism, Trade",1.为岩手县企业与中国企业的经贸交流提供咨询和联络的支援； 2.为岩手县在中国的旅游事业提供咨询和宣传的支援； 3.为岩手县大学和科研机关在中国的技术交流提供支援。,Liaoning,2017-12-28,"Anhui, Beijing, Chongqing, Fujian, Gansu, Guangdong, Guangxi, Guizhou, Hainan, Hebei, Heilongjiang, Henan, Hubei, Hunan, Inner Mongolia, Jiangsu, Jiangxi, Jilin, Liaoning, Ningxia, Qinghai, Shaanxi, Shandong, Shanghai, Shanxi, Sichuan, Tianjin, Tibet, Xinjiang, Zhejiang",,,辽宁省大连市中山区 人民路15，17号 国际金融大厦 13F-B,12,,,,,,,,,,,,,,,,,1,,,,,,,,,,,1,1,,,,1,1,1,1,1,1,1,1,1,1,1,1,1,1,1,1,1,1,1,1,1,1,1,1,1,1,1,1,1,,,1,,3,30,"北京市,天津市,河北省,山西省,内蒙古自治区,辽宁省,吉林省,黑龙江省,上海市,江苏省,浙江省,安徽省,福建省,江西省,山东省,河南省,湖北省,湖南省,广东省,广西壮族自治区,海南省,重庆市,四川省,贵州省,西藏自治区,陕西省,甘肃省,青海省,宁夏回族自治区,新疆维吾尔自治区",,,
"102.721977, 25.02168",x,x,1,,Iwate Industrial Revitalization Center (Yunnan),日本公益财团法人岩手产业振兴中心,Yunnan People’s Association for Friendship with Foreign Countries,云南省人民对外友好协会,Japan,"Agriculture, Arts and Culture, Economic Development, Education, Environment, International Relations/Exchange, Tourism, Trade",关于经济、旅游、农业、林业、教育及文化等交流合作的联系、协调与咨询等,Yunnan,2018-03-09,Yunnan,,,云南省昆明市官渡区 北京路155号附1号 红塔大厦2202室,15,,1,,1,,,,1,1,,1,,,,,,1,,,,,,,,,,,1,1,,,,,,,,,,,,,,,,,,,,,,,,,,,,,,,,,,1,,,8,1,云南省,,,
"109.314239, 40.45682",x,x,,The ,Japan Association for Greening Deserts,特定非营利活动法人日本沙漠绿化实践协会,Inner Mongolia Forestry and Grassland Administration (formerly Inner Mongolia Forestry Administration),内蒙古自治区林业厅,Japan,Environment,内蒙古自治区内植树造林,Inner Mongolia,2017-08-11,Inner Mongolia,,,内蒙古自治区鄂尔多斯市达拉特旗 恩格贝生态示范区漠中绿洲酒店122房间,8,,,,,,,,,,,1,,,,,,,,,,,,,,,,,,,,,,,,,,,,,,,,,,,,1,,,,,,,,,,,,,,,,,,,1,1,内蒙古自治区,,,
"116.466315, 39.909089",x,x,,,"Japan Automobile Manufacturers Association, Inc.",一般社团法人日本汽车工业协会,Beijing Commission of Commerce,北京市商务委员会,Japan,Trade,有关汽车生产、销售的市场调查、信息收集和相关的业务联络。,Beijing,2017-05-19,"Anhui, Beijing, Chongqing, Fujian, Gansu, Guangdong, Guizhou, Hebei, Heilongjiang, Henan, Hubei, Hunan, Inner Mongolia, Jiangsu, Jiangxi, Jilin, Liaoning, Qinghai, Shaanxi, Shandong, Shanghai, Shanxi, Sichuan, Tianjin, Yunnan, Zhejiang",http://www.jama-english.jp/,,北京市朝阳区建国门外大街1号（二期）国贸写字楼2座10层1001B单元,5,,,,,,,,,,,,,,,,,,,,,,,,,,,,,1,,,,1,1,1,1,1,1,,1,,1,1,1,1,1,1,1,1,1,1,,1,1,1,1,1,1,1,,,,1,1,,1,26,广东省、安徽省、湖北省、山东省、江西省、青海省、贵州省、吉林省、重庆市、天津市、辽宁省、山西省、河南省、内蒙古自治区、四川省、福建省、甘肃省、江苏省、黑龙江省、云南省、陕西省、上海市、河北省、北京市、浙江省、湖南省,,,
"116.437351, 39.908347",x,x,,,Japan Grain Inspection Association,日本榖物检定协会,General Administration of Customs,中华人民共和国海关总署,Japan,Trade,从事与本部业务相关的咨询、联络工作。,Beijing,2019-03-05,China,,http://www.kokken.or.jp/,北京市朝阳区 建国门外大街26号长富宫饭店3层3007室,27,,,,,,,,,,,,,,,,,,,,,,,,,,,,,1,,,1,,,,,,,,,,,,,,,,,,,,,,,,,,,,,,,,,,1,0,中国境内,,,
"116.439146, 39.907563",x,x,,,Japan International Cooperation Center,日本国际协力中心,Chinese People’s Association for Friendship with Foreign Countries,中国人民对外友好协会,Japan,"Civil Society Capacity-Building, Education, International Relations/Exchange, Technology, Trade",开展促进中日友好人员交流（学术交流、共同研究、经济贸易、科学技术、公共服务）的项目。,Beijing,2018-07-18,China,,,北京市朝阳区 建国门外大街甲24号东海中心606室,19,,,,,1,,,,1,,,,,,,,1,,,,,,,,,,1,,1,,,1,,,,,,,,,,,,,,,,,,,,,,,,,,,,,,,,,,5,0,中国境内,,,
"116.439755, 39.907465",x,x,,,Japan Iron and Steel Federation,一般社团法人日本铁钢连盟,Beijing Commission of Commerce,北京市商务委员会,Japan,Trade,从事与中国钢铁行业界的经贸交流和钢铁市场的信息收集、信息交流等业务的联络（不得开展经营活动收取费用）,Beijing,2017-07-05,Beijing,,,北京市朝阳区建国门外大街丙24号8层901/902室,7,,,,,,,,,,,,,,,,,,,,,,,,,,,,,1,,,,,1,,,,,,,,,,,,,,,,,,,,,,,,,,,,,,,,1,1,北京市,,,
"117.222949, 39.112891",x,x,,,Japan Kobe International Cooperation and Exchange Center,日本神户国际合作交流中心,Tianjin Commission of Commerce,天津市商务委员会,Japan,"International Relations/Exchange, Trade",神户 天津，中国间友好交流，经贸合作的联络的协调,Tianjin,2017-05-12,Tianjin,,http://www.tj-kobe.org/zh/,天津市河西区解放南路283号创展大厦11B室,5,,,,,,,,,,,,,,,,,1,,,,,,,,,,,,1,,,,,,,,,,,,,,,,,,,,,,,,,,,,,,1,,,,,,,2,1,天津市,,,
"116.438464, 39.907471",x,x,1,,Japan-China Economic Association (Beijing),一般财团法人日中经济协会,Beijing Commission of Commerce,北京市商务委员会,Japan,"Economic Development, Trade",支援本协会事业活动，随时与中国国际贸易促进委员会联络，开展促进日中两国的经济贸易和技术交流业务。,Beijing,2017-11-30,"Beijing, Fujian, Guangdong, Hebei, Henan, Shandong, Tianjin",,,北京市朝阳区 建国门外大街甲26号 长富宫办公楼401室,11,,,,,,,,1,,,,,,,,,,,,,,,,,,,,,1,,,,,1,,1,,1,,,,1,,1,,,,,,,,,,,1,,,,1,,,,,,,2,7,"北京市,天津市,河北省,福建省,山东省,河南省,广东省",,,
"104.065243, 30.656508",x,x,1,,Japan-China Economic Association (Chengdu),日本日中经济协会,Sichuan Department of Commerce,四川省商务厅,Japan,Trade,开展促进中日两国之间的经贸投资业务,Sichuan,2018-03-16,Sichuan,,,四川省成都市青羊区 人民南路一段86号城市之心大厦18楼N座,15,,,,,,,,,,,,,,,,,,,,,,,,,,,,,1,,,,,,,,,,,,,,,,,,,,,,,,,,,,,1,,,,,,,,1,1,四川省,,,
