"117.041644, 39.37404",x,x,,,POP’s Foundation,慈亲基金会,Tianjin Department of Civil Affairs,天津市民政局,United States,"Disabilities, Education, Youth",(1)积极联合国家教育行政部门及高等师范院校为内地学校校长及教师提供专业培训； (2)资助内地学校改善办学条件和环境、发展校本特色，推动开发中华文化和德育课程，引进国际先进教育教学理念，提升其自主创新能力，促进可持续优质发展； (3)创建卓越知识平台及专业社群网络，推动大学与内地学校、香港与内地学校的协作关系，拓展交流网络、策略伙伴及区域性合作，开发具有可持续性、区域示范性的项目，推广成功项目经验； (4)资助或主办全国、区域性及国际性教育教学研讨会及论坛，资助内地教育学者、学校校长、师生赴港澳台访问交流；为内地田家炳学校学生设立奖学金及表扬卓越教育人才的奖项,Tianjin,2017-05-12,Tianjin,http://popsfoundation.org/,http://popsfoundation.org/about-popf_ch_s/,天津市武清区 杨村镇泉旺路松鹤园小区内,5,,,,,,1,,,1,,,,,,,,,,,,,,,,,,,,,,1,,,,,,,,,,,,,,,,,,,,,,,,,,,,1,,,,,,,3,1,天津市,,,
"116.476225, 39.913033",x,x,,,Prince Albert II of Monaco Foundation,摩纳哥阿尔贝二世亲王基金会,Ministry of Ecology and Environment (formerly Ministry of Environmental Protection),生态环境部,Monaco,"Energy, Environment",生物多样性保护、保护濒危物种、发展自然保护区、对抗森林退化、研究气候变化及其影响、（水、大气等）污染防治、海洋酸化、发展海洋保护区、水资源综合管理及获取、开发能源效率和可再生能源、环境宣传教育。积极在以上优先领域内开展项目，并动员公众、政治家、科学家和经济参与者一起保护大自然这份人类的共同遗产。,Beijing,2019-03-25,China,http://www.fpa2.org/home.html,N/A,北京市朝阳区 西大望路3号院3号楼房号1509,27,,,,,,,,,,1,1,,,,,,,,,,,,,,,,,,,,,1,,,,,,,,,,,,,,,,,,,,,,,,,,,,,,,,,,2,0,中国境内,,,
"116.314745, 39.938229",x,x,1,,Project HOPE (Beijing),世界健康基金会,National Health Commission (formerly National Health and Family Planning Commission),国家卫生和计划生育委员会,United States,Health,不断支持国家卫生和计划生育委员会在全国范围内开展健康方面的活动。只要本基金会拥有或获得足够的资金，不断提供其他人道主义援助。协助国家卫生和计划生育委员会及其下属机构开展其他与健康相关的教育及培训项目，支持全国性的计划及有意义的活动。,Beijing,2017-01-23,"Beijing, Hubei, Tianjin",http://www.projecthope.org.cn/plus/list.php?tid=19,http://www.projecthope.org.cn/,北京市海淀区西三环北路50号豪柏大厦C1座1207室,1,,,,,,,,,,,,,,1,,,,,,,,,,,,,,,,,,,,1,,,,,,,,,,,1,,,,,,,,,,,,,,1,,,,,,,1,3,北京市、天津市、湖北省,,,"255 Carter Hall Lane, PO Box 250, Millwood, VA 22646"
"121.524397, 31.205693",x,x,1,,Project HOPE (Shanghai),世界健康基金会,Shanghai Health Commission (formerly Shanghai Health and Family Planning Commission),上海市卫生和计划生育委员会,United States,"Disaster Relief, Health, Poverty Alleviation",卫生、健康、济困、救灾,Shanghai,2017-01-17,"Anhui, Fujian, Guangdong, Guangxi, Guizhou, Heilongjiang, Inner Mongolia, Jiangsu, Qinghai, Shandong, Shanghai, Sichuan, Tibet, Xinjiang, Yunnan, Zhejiang",http://www.projecthope.org.cn/plus/list.php?tid=19,http://www.projecthope.org.cn/,上海市浦东新区东方路1678号行政楼204室,1,,,,,,,1,,,,,,,1,,,,,,,,,1,,,,,,,,,,1,,,1,,1,1,1,,,1,,,,1,1,,,,,1,,1,1,,1,,1,1,,1,1,,3,16,上海、内蒙、辽宁、黑龙江、江苏、浙江、安徽、福建、山东、广东、广西、四川、贵州、云南、西藏、青海、新疆,,,"255 Carter Hall Lane, PO Box 250, Millwood, VA 22646"
"121.421535, 31.257114",x,x,,,Pyrexa Global,道合兴华,Shanghai Commission of Commerce,上海市商务委员会,United States,"Economic Development, Trade",加强并促进经贸方面的业务联络；从事商业培训、技能交流活动；开展多元化经济合作新形式。,Shanghai,2018-03-19,"Chongqing, Fujian, Gansu, Guangdong, Guangxi, Heilongjiang, Jiangsu, Liaoning, Shaanxi, Shandong, Shanghai, Sichuan, Yunnan, Zhejiang",https://www.pyxeraglobal.org/,,上海市普陀区 岚皋路567号1117s-03室,15,,,,,,,,1,,,,,,,,,,,,,,,,,,,,,1,,,,,,1,1,1,1,1,,,,1,,,,,1,,,1,,,1,1,1,,1,,,,,1,1,,2,14,"北京市,天津市,辽宁省,黑龙江省,上海市,江苏省,浙江省,福建省,山东省,广东省,广西壮族自治区,重庆市,四川省,云南省,陕西省,甘肃省",,,DC
"114.326666, 30.583873",x,x,,,Rare,瑞尔保护协会,Hubei Department of Agriculture and Rural Affairs (formerly Hubei Department of Agriculture),湖北省农业厅,United States,"Agriculture, Environment",瑞尔保护协会将开展为期5年的“瑞尔有机农业先锋伙伴项目”，通过“两减”（农药、化肥）和土壤水质保护，开展有机种植示范，有机种植技术研究，有机标准培训，环境教育，市场销售等相关活动，对有机种植示范基地进行全过程的环境影响监测和评估,Hubei,2017-10-31,Hubei,https://www.rare.org/,https://www.rare.org/zh-hans#.WfyElhNSwg0,湖北省武汉市武昌区 和平大道绿地国际金融城绿地蓝海A座1309,10,,1,,,,,,,,,1,,,,,,,,,,,,,,,,,,,,,,,,,,,,,,,,,,1,,,,,,,,,,,,,,,,,,,,,2,1,湖北省,,,
"112.997581, 28.114689",x,x,,,Reading Dreams,《阅读·梦飞翔》文化关怀慈善基金有限公司,Hunan Department of Education,湖南省教育厅,Hong Kong,"Education, Poverty Alleviation, Youth",帮助农村中小学建立图书馆，推广阅读教育及其他助学活动。,Hunan,2017-05-16,Hunan,,http://www.readingdreams.com,湖南省长沙市天心区 湘府中路188号国检园2栋3单元2016,5,,,,,,,,,1,,,,,,,,,,,,,,1,,,,,,,,1,,,,,,,,,,,,,,,1,,,,,,,,,,,,,,,,,,,,3,1,湖南省,,,
"116.411818, 39.933598",x,x,,,Recording Industry Association of Japan,日本唱片业协会,National Copyright Administration,国家版权局,Japan,Trade,涉外著作权认证； 有关著作权法规的研究及宣传普及； 会员合法权益保护的联络协调； 开展中日音乐产业和著作权的交流。,Beijing,2017-08-15,China,http://www.riaj.or.jp/e/?requestLocale=en,,北京市东城区张自忠路十号华人一品大厦2132,8,,,,,,,,,,,,,,,,,,,,,,,,,,,,,1,,,1,,,,,,,,,,,,,,,,,,,,,,,,,,,,,,,,,,1,0,中国境内,,,
"116.457943, 39.91455",x,x,,,Rockefeller Brothers Fund,洛克菲勒兄弟基金会,Ministry of Ecology and Environment (formerly Ministry of Environmental Protection),中华人民共和国环境保护部,United States,"Education, Environment, Law and Governance",污染防治（水污染防治、大气污染防治、环境监测、环境立法和执法、环境宣传教育）；气候变化,Beijing,2017-11-17,"Beijing, Chongqing, Fujian, Guangdong, Guangxi, Guizhou, Hainan, Hunan, Jiangxi, Sichuan, Yunnan",https://www.rbf.org/,,北京市朝阳区 光华路1号嘉里中心北楼11层36室,11,,,,,,,,,1,,1,,,,,,,,1,,,,,,,,,,,,,,,1,1,1,,1,1,1,1,,,,,1,,,1,,,,,,,,,1,,,,,1,,,3,11,"北京市,福建省,江西省,湖南省,广东省,广西壮族自治区,海南省,重庆市,四川省,贵州省,云南省",,,
"116.454472, 39.915865",x,x,,,Rocky Mountain Institute,落基山研究所,National Energy Administration,国家能源局,United States,"Energy, Environment, Infrastructure, Law and Governance, Technology, Urban Issues/Development",与节能降碳及城市能源变革相关的电力、工业、交通、建筑等政策研究、行业措施、技术模型和商业模式以及相关项目执行。,Beijing,2017-11-29,Beijing,https://www.rmi.org/,http://www.rmi-china.com/index.php,北京市朝阳区 金桐西路10号远洋光华国际A座605,11,,,,,,,,,,1,1,,,,,1,,,1,,,,,,,,1,,,1,,,,1,,,,,,,,,,,,,,,,,,,,,,,,,,,,,,,,6,1,北京市,,,
"116.458655, 39.934549",x,x,,,Rosa Luxemburg Stiftung,罗莎·卢森堡基金会,Chinese People’s Association for Friendship with Foreign Countries,中国人民对外友好协会,Germany,"Education, International Relations/Exchange",推动广大中外人员交流；合作开展学术交流活动；开展联合研究项目。,Beijing,2017-05-19,China,https://www.rosalux.de/en/,,北京市朝阳区工体北路1号三里屯外交公寓3-2-12,5,,,,,,,,,1,,,,,,,,1,,,,,,,,,,,,,,,1,,,,,,,,,,,,,,,,,,,,,,,,,,,,,,,,,,2,0,中国境内,,,
"121.587906, 31.348573",x,x,,,Russia Foodstuff Producers and Suppliers Association,俄罗斯食品生产者与供应者协会,Shanghai Commission of Commerce,上海市商务委员会,Russia,Trade,食品领域技术交流、咨询、业务联络。,Shanghai,2018-01-26,"Anhui, Beijing, Chongqing, Fujian, Guangdong, Hebei, Heilongjiang, Henan, Hunan, Jiangsu, Jiangxi, Jilin, Liaoning, Shandong, Shanghai, Sichuan, Tianjin, Zhejiang",,,上海市浦东新区 马吉路2号6层607室,13,,,,,,,,,,,,,,,,,,,,,,,,,,,,,1,,,,1,1,1,1,,1,,,,1,1,1,,1,,1,1,1,1,,,,1,1,,1,1,,,,,1,,1,18,"北京市,天津市,河北省,辽宁省,吉林省,黑龙江省,上海市,江苏省,浙江省,安徽省,福建省,江西省,山东省,河南省,湖南省,广东省,重庆市,四川省",,,
"112.893108, 28.214863",x,x,,,"Russia-China Culture, Education, Science, and Technology Development Foundation",俄中文化教育科技发展基金会,Hunan Department of Science and Technology,湖南省科学技术厅,Russia,"Arts and Culture, Education, Energy, Environment, International Relations/Exchange, Technology",主要从事科技创新孵化和科技成果转移（涵盖环保新能源利用，高端智能装备制造，新材料工艺制备等领域），高科技项目以及人才的引进交流，开展国际教育合作，文化交流。,Hunan,2019-01-31,Hunan,,,湖南省长沙市岳麓区 长沙高新开发区麓谷大道662号长沙软件园大楼016室,25,,,,1,,,,,1,1,1,,,,,,1,,,,,,,,,,1,,,,,,,,,,,,,,,,,,,1,,,,,,,,,,,,,,,,,,,,6,1,湖南省,,,
"121.517633, 31.226949",x,x,,,Russian Federation Chamber of Commerce and Industry,俄罗斯联邦工商会,Shanghai Commission of Commerce,上海市商务委员会,Russia,Trade,从事有关扩大俄国产品的进出口和促进俄中企业界人士的交流与合作，及寻求经济、技术合作新形式的联络工作,Shanghai,2017-01-17,"Anhui, Chongqing, Fujian, Guangdong, Guizhou, Hainan, Hubei, Hunan, Jiangsu, Jiangxi, Shanghai, Sichuan, Tibet, Yunnan, Zhejiang",,,自由贸易试验区浦东南路1271-1289号华融大厦17楼1701-1702室,1,,,,,,,,,,,,,,,,,,,,,,,,,,,,,1,,,,1,,1,1,,1,,1,1,,,,1,1,,1,1,,,,,,,1,,1,,1,,,1,1,,1,15,上海、江苏、浙江、安徽、福建、江西、湖北、湖南、广东、广西、海南、重庆、四川、贵州、云南、西藏,,,
"104.03389, 30.631668",x,x,1,The ,Salvation Army (Sichuan),救世军,Sichuan Department of Civil Affairs,四川省民政厅,Hong Kong,"Civil Society Capacity-Building, Disaster Relief, Youth",与社会组织和公益性事业单位开展救灾减灾、社会救助、儿童福利事业、社区服务等公益项目合作。,Sichuan,2017-07-27,Sichuan,http://www.salvationarmy.org.hk/en,http://www.salvationarmy.org.hk/cn/,四川省成都市武侯区二环路南四段51号4栋4层56室,7,,,,,1,,1,,,,,,,,,,,,,,,,,,,,,,,,1,,,,,,,,,,,,,,,,,,,,,,,,,,,1,,,,,,,,3,1,四川省,,,
"102.732926, 25.012507",x,x,1,The ,Salvation Army (Yunnan),救世军,Yunnan Department of Civil Affairs,云南省民政厅,Hong Kong,"Civil Society Capacity-Building, Disaster Relief, Youth",与社会组织和公益性事业单位开展救灾减灾、社会救助、儿童福利事业、社区服务等公益项目合作。,Yunnan,2017-07-27,Yunnan,http://www.salvationarmy.org.hk/en,http://www.salvationarmy.org.hk/cn/,云南省昆明市官渡区关兴路银海温泉花园北区8－1－6D,7,,,,,1,,1,,,,,,,,,,,,,,,,,,,,,,,,1,,,,,,,,,,,,,,,,,,,,,,,,,,,,,,,,1,,,3,1,云南省,,,
"116.43751, 39.910743",x,x,,,Save the Children,国际救助儿童会,Ministry of Civil Affairs,民政部,United Kingdom,"Disaster Relief, Education, Health, Youth",开展儿童福利和保护、救灾、教育、健康、儿童权益等项目。,Beijing,2017-01-23,China,http://china.savethechildren.net/,http://www.savethechildren.org.cn/,北京市朝阳区秀水街1号建外外交公寓2号楼2单元51、52室,1,,,,,,,1,,1,,,,,1,,,,,,,,,,,,,,,,,1,1,,,,,,,,,,,,,,,,,,,,,,,,,,,,,,,,,,4,0,中国,,,
"116.459408, 39.908987",x,x,1,,Scottish Development International (Beijing),苏格兰工商委员会,Beijing Commission of Commerce,北京市商务委员会,United Kingdom,Trade,从事贸易、投资的市场调研、信息收集和与中国有关部门商务联系等方面的联络工作。,Beijing,2018-02-07,"Beijing, Gansu, Hebei, Heilongjiang, Henan, Inner Mongolia, Jilin, Liaoning, Ningxia, Qinghai, Shaanxi, Shandong, Shanxi, Tianjin, Xinjiang",https://www.sdi.co.uk/locations/asia-and-pacific/china-shanghai/shanghai-office-details?intcmp=locmap,,北京市朝阳区建国门外大街1号（二期）24层2401-37单元,14,,,,,,,,,,,,,,,,,,,,,,,,,,,,,1,,,,,1,,,1,,,,,1,1,1,,,1,,,1,1,1,1,1,1,,1,,1,,1,,,,,1,15,"北京市,天津市,河北省,山西省,内蒙古自治区,辽宁省,吉林省,黑龙江省,山东省,河南省,陕西省,甘肃省,青海省,宁夏回族自治区,新疆维吾尔自治区",,,
"121.500906, 31.236778",x,x,1,,Scottish Development International (Shanghai),英国苏格兰工商委员会,Shanghai Commission of Commerce,上海市商务委员会,United Kingdom,Trade,从事有关在华贸易和投资方面的信息交流、市场调研，为促进英国苏格兰和中国间经贸往来进行业务联络,Shanghai,2017-11-12,"Anhui, Chongqing, Fujian, Guangdong, Guangxi, Guizhou, Hainan, Hubei, Hunan, Jiangsu, Jiangxi, Shanghai, Sichuan, Tibet, Yunnan, Zhejiang",https://www.sdi.co.uk/locations/asia-and-pacific/china-shanghai/shanghai-office-details?intcmp=locmap,,上海浦东新区世纪大道8号国金中心二期8楼819-820室，200120,11,,,,,,,,,,,,,,,,,,,,,,,,,,,,,1,,,,1,,1,1,,1,1,1,1,,,,1,1,,1,1,,,,,,,1,,1,,1,,,1,1,,1,16,"上海市,江苏省,浙江省,安徽省,福建省,江西省,湖北省,湖南省,广东省,广西壮族自治区,海南省,重庆市,四川省,贵州省,云南省,西藏自治区",,,
"116.413473, 39.897175",x,x,,,Shih Wing Ching Foundation,施永青基金,Chinese People’s Association for Friendship with Foreign Countries,中国人民对外友好协会,Hong Kong,"Arts and Culture, Civil Society Capacity-Building, Economic Development, Education, Health, International Relations/Exchange",在教育、经济、文化和卫生领域，支持乡村综合发展，支持社会工作、社会福利、社会组织、农村集体经济组织发展，支持国际化的人文交流、人才培养和人民友好。,Beijing,2017-11-23,China,,,北京市东城区东兴隆街58号7层717,11,,,,1,1,,,1,1,,,,,1,,,1,,,,,,,,,,,,,,,1,,,,,,,,,,,,,,,,,,,,,,,,,,,,,,,,,,6,0,中国境内,,,
"116.494412, 39.934857",x,x,,,Shin Shin Educational Foundation,欣欣教育基金会,State Council Overseas Chinese Affairs Office,国务院侨务办公室,United States,"Education, Health, Infrastructure, Youth",帮助中国偏远贫困地区新建或改造中小学校；提供后续设施改善基金，继续改善学校硬件设施；开展各项教学专案、师资培训；开展儿童心理和生理健康保健等；帮助提高欣欣学校的教学质量，促进城乡教育均衡发展。,Beijing,2017-01-23,China,http://www.shinshinfoundation.org/new_site/index.php/language/en/,http://www.shinshinfoundation.org/new_site/index.php/language/zh/,北京市朝阳区姚家园路105号1702室,1,,,,,,,,,1,,,,,1,,1,,,,,,,,,,,,,,,1,1,,,,,,,,,,,,,,,,,,,,,,,,,,,,,,,,,,4,0,中国,,,
"121.404729, 31.202207",x,x,,,Shizuoka Prefecture International Economic Revitalization Association,日本公益财团法人静冈县国际经济振兴会,Shanghai Commission of Commerce,上海市商务委员会,Japan,Trade,从事有关促进进出口贸易及相关投资业务的经济贸易合作和交流方面的业务联系,Shanghai,2018-03-12,China,,,上海市长宁区延安西路2201号上海国际贸易中心2611室,15,,,,,,,,,,,,,,,,,,,,,,,,,,,,,1,,,1,,,,,,,,,,,,,,,,,,,,,,,,,,,,,,,,,,1,0,中国境内,,,
"113.202606, 22.82947",x,x,,,Shun Long Ren Ze Foundation,顺龙仁泽基金会,Ministry of Civil Affairs,民政部,Hong Kong,"Education, Poverty Alleviation",救助贫困、促进教育等有益于国内具慈善性质的活动,Guangdong,2017-01-19,Guangdong,,,广东省佛山市顺德区大良东区立田路建筑设计大厦11楼,1,,,,,,,,,1,,,,,,,,,,,,,,1,,,,,,,,,,,,,,,1,,,,,,,,,,,,,,,,,,,,,,,,,,,,2,1,广东省,,,
"102.703989, 25.045182",x,x,,,SIL International,世界少数民族语文研究院,Yunnan Department of Education,云南省教育厅,United States,"Education, Ethnic Affairs",在滇与公益性事业单位和社会组织开展少数民族教育项目,Yunnan,2017-10-20,Yunnan,https://www.sil.org/,,云南省昆明市五华区 青年路延长线53号滨江大厦2栋18层,10,,,,,,,,,1,,,1,,,,,,,,,,,,,,,,,,,,,,,,,,,,,,,,,,,,,,,,,,,,,,,,,,,1,,,2,1,云南省,2018-10-20,address,
"116.41343, 39.897084",x,x,1,,Silk Road Chamber of International Commerce (Beijing),丝绸之路国际总商会,Beijing Commission of Commerce,北京市商务委员会,Hong Kong,"Arts and Culture, International Relations/Exchange, Trade",推动丝绸之路贸易和文化复兴，推动国际商务的和谐自由发展，促使其成员抓住丝绸之路经济带的贸易投资机会，联结会员间商贸交流合作，帮助其会员与丝绸之路沿线国家和地区的政府机构和部门建立合作关系。,Beijing,2017-08-15,Beijing,http://www.srcic.com/,http://www.srcic.com/shouye/,北京市东城区 东兴隆街58号3层302,8,,,,1,,,,,,,,,,,,,1,,,,,,,,,,,,1,,,,,1,,,,,,,,,,,,,,,,,,,,,,,,,,,,,,,,3,1,北京市,,,
"108.909926, 34.246388",x,x,1,,Silk Road Chamber of International Commerce (Shaanxi),丝绸之路国际总商会,Shaanxi Department of Commerce,陕西省商务厅,Hong Kong,"Arts and Culture, International Relations/Exchange, Trade",业务范围：为国内外会员企业及商协会组织提供与投资贸易有关的商贸文化交流咨询服务。 活动宗旨：和平合作、开放包容、互学互鉴、互利共赢,Shaanxi,2017-05-31,"Anhui, Chongqing, Fujian, Gansu, Guangdong, Guangxi, Guizhou, Hainan, Hebei, Heilongjiang, Henan, Hubei, Hunan, Inner Mongolia, Jiangsu, Jiangxi, Jilin, Liaoning, Ningxia, Qinghai, Shaanxi, Shandong, Shanghai, Shanxi, Sichuan, Tianjin, Tibet, Xinjiang, Xinjiang Bingtuan, Yunnan, Zhejiang",http://www.srcic.com/,,陕西省西安市莲湖区劳动南路118号大唐西市九坊4楼,5,,,,1,,,,,,,,,,,,,1,,,,,,,,,,,,1,,,,1,,1,1,1,1,1,1,1,1,1,1,1,1,1,1,1,1,1,1,1,1,1,1,1,1,1,1,1,1,1,1,,3,31,"浙江省,黑龙江省,上海市,湖南省,河北省,云南省,广东省,安徽省,宁夏回族自治区,湖北省,山东省,江西省,青海省,新疆维吾尔自治区,陕西省,新疆兵团,贵州省,吉林省,重庆市,天津市,辽宁省,山西省,河南省,内蒙古自治区,海南省,四川省,福建省,甘肃省,西藏自治区,广西壮族自治区,江苏省",,,
"121.48271, 31.172749",x,x,1,,Silk Road Chamber of International Commerce (Shanghai),丝绸之路国际总商会,Shanghai Commission of Commerce,上海市商务委员会,Hong Kong,"Arts and Culture, International Relations/Exchange, Trade",推动丝绸之路贸易和文化复兴，推动国际商务的和谐自由发展，促使其成员抓住丝绸之路经济带的贸易投资机会，联结会员间商贸交流合作，帮助其会员与丝绸之路沿线国家和地区的政府机构和部门建立合作关系。,Shanghai,2018-01-09,Shanghai,http://www.srcic.com/,http://www.srcic.com/shouye/,上海市浦东新区 耀华路488号2110室,13,,,,1,,,,,,,,,,,,,1,,,,,,,,,,,,1,,,,,,,,,,,,,,,,,,,,,,,,,,,1,,,,,,,,,,3,1,上海市,,,
"108.270743, 22.806203",x,x,,,Silver Lining Foundation,云彩行动有限公司,Guangxi Department of Civil Affairs,广西壮族自治区民政厅,Hong Kong,"Migrants, Poverty Alleviation, Youth",帮扶留守儿童、困境儿童等儿童群体,Guangxi,2018-10-19,Guangxi,http://www.thesilverliningfoundation.com/index.php/en/,http://www.thesilverliningfoundation.com/index.php/zh-TW/,广西壮族自治区南宁市江南区 五一西路1号富宁新兴苑1栋8A号商铺,22,,,,,,,,,,,,,,,,,,,,,,1,1,,,,,,,,1,,,,,,,,1,,,,,,,,,,,,,,,,,,,,,,,,,,,3,1,广西壮族自治区,,,
"121.506752, 31.243488",x,x,,,Singapore International Arbitration Centre (SIAC),新加坡国际仲裁中心,Shanghai Commission of Commerce,上海市商务委员会,Singapore,"Law and Governance, Trade",从事有关在华贸易和投资方面的信息交流、市场调研，为促进两地间经贸往来进行业务联络。,Shanghai,2018-02-28,"Beijing, Chongqing, Fujian, Guangdong, Guangxi, Guizhou, Jiangsu, Shandong, Shanghai, Sichuan, Yunnan, Zhejiang",http://www.siac.org.sg/,,上海市浦东新区 银城中路68号时代金融中心22楼2218室,14,,,,,,,,,,,,,,,,,,,1,,,,,,,,,,1,,,,,1,1,1,,1,1,1,,,,,,,,1,,,,,,,1,1,,1,,,,,1,1,,2,12,"北京市,上海市,江苏省,浙江省,福建省,山东省,广东省,广西壮族自治区,重庆市,四川省,贵州省,云南省",,,
"106.570314, 29.557615",x,x,,,Sino-American Friendship Association,美中友好协会,Chongqing Culture and Tourism Development Commission (formerly Chongqing Tourism Development Commission),重庆市旅游发展委员会,United States,"Arts and Culture, Education, International Relations/Exchange, Sport, Tourism, Trade",代表协会负责会务会展活动联络和咨询；商业、文化、旅游、体育、教育等交流活动的沟通、联络、咨询；代表协会参加中国境内相关项目的招投标。,Chongqing,2018-09-04,China,http://www.safaus.org/index.html,http://www.safaus.org/index_cn.html,重庆市渝中区民生路283号重庆宾馆商务大厦618室,21,,,,1,,,,,1,,,,,,,,1,,,,,,,,,1,,1,1,,,1,,,,,,,,,,,,,,,,,,,,,,,,,,,,,,,,,,6,0,中国境内,,,
"116.476043, 39.907472",x,x,,,Smile Train,微笑列车基金会,National Health Commission (formerly National Health and Family Planning Commission),国家卫生和计划生育委员会,United States,"Education, Health",代表微笑列车为在中国的目标受助人群提供循序渐进的手术治疗和一系列必要的医疗救助、辅助治疗和康复以矫正他们的生理性不正常；向相关医务工作人员和社会工作者提供相关医疗培训和科普教育，以提高其学术能力和业务水平，更好地为目标受助人群服务。,Beijing,2017-01-23,China,https://www.smiletrain.org/,http://www.smiletrainchina.org/,北京市朝阳区建国路88号SOHO现代城D座2307室,1,,,,,,,,,1,,,,,1,,,,,,,,,,,,,,,,,,1,,,,,,,,,,,,,,,,,,,,,,,,,,,,,,,,,,2,0,中国,,,
"114.374234, 30.510127",x,x,,,Social Workers Across Borders,无国界社工有限公司,Hubei Province Department of Civil Affairs,湖北省民政厅,Hong Kong,"Aging, Civil Society Capacity-Building",开创湖北孤老善养服务及社工培训,Hubei,2018-12-05,Hubei,,https://www.swab.org.hk/tc/,湖北省武汉市洪山区卓刀泉路208号湖北省荣军医院,24,1,,,,1,,,,,,,,,,,,,,,,,,,,,,,,,,,,,,,,,,,,,,,,1,,,,,,,,,,,,,,,,,,,,,2,1,湖北省,,,
"113.251577, 23.118188",x,x,,,Sociedad Central de Beneficencia China,中华通惠总局,Guangdong Office of Overseas Chinese Affairs,广东省人民政府侨务办公室,Peru,"Aging, Arts and Culture, Civil Society Capacity-Building, Education, International Relations/Exchange, Poverty Alleviation",办理全体旅秘华侨各种福利事务： 1、	提倡教育事业，弘扬中华文化，培育人才； 2、	协助安置贫老无依无靠之华侨进住老人院安度晚年； 3、	协助属下各会馆社团办理公益慈善事业； 4、	参照法律，依法调解华侨中发生的纠纷事件； 5、	协助华侨向我使领馆申请发给回国护照所需一切证件； 6、	维护华侨享受侨居国一切正当利益； 7、	协助使领馆保护华侨之生命财产，及办理上述各项所需手续，协助使馆接待国内各级领导人访问居住国； 8、提高华侨爱国爱乡精神，加强国民外交，增进友邦联系。,Guangdong,2018-12-17,China,,http://www.scbcperu.com/,广东省广州市荔湾区光复中路荣业里8-10号,24,1,,,1,1,,,,1,,,,,,,,1,,,,,,1,,,,,,,,,1,,,,,,,,,,,,,,,,,,,,,,,,,,,,,,,,,,6,0,中国境内,,,
"116.462975, 39.907128",x,x,,The ,Software Alliance,商业软件联盟,National Copyright Administration,国家版权局,United States,Trade,从事本联盟会员公司计算机版权相关的认证联络、维权与宣传教育工作；从事计算机软件、云计算、网络安全、数据信息及知识产权等相关法律政策的研究与推进工作。,Beijing,2017-05-19,China,http://www.bsa.org/?sc_lang=en-US,http://www.bsa.org/?sc_lang=zh-CN,北京市朝阳区建国路乙118号京汇大厦903室,5,,,,,,,,,,,,,,,,,,,,,,,,,,,,,1,,,1,,,,,,,,,,,,,,,,,,,,,,,,,,,,,,,,,,1,0,中国境内,,,
"121.482104, 31.233248",x,x,,,South Korea Busan Conference Center,韩国釜山商工会议所,Shanghai Commission of Commerce,上海市商务委员会,South Korea,Trade,从事有关在华贸易及投资方面的信息交流、市场调研，为促进两国间的经贸往来进行业务联络。,Shanghai,2018-04-27,China,,,上海市黄浦区 广东路500号1302室,16,,,,,,,,,,,,,,,,,,,,,,,,,,,,,1,,,1,,,,,,,,,,,,,,,,,,,,,,,,,,,,,,,,,,1,0,中国境内,,,
